{
  "pr_id": "22222222-2222-4222-8222-222222222222",
  "revision": 1,
  "content_hash": "0123456789abcdef0123456789abcdef0123456789abcdef0123456789abcdef",
  "changes": [
    {
      "operation": "update",
      "schema": "public",
      "table": "invoices",
      "key": {"id": "482"},
      "expected_revision": "12",
      "fields": [
        {"column": "payment_terms", "type": "text", "before": "net_15", "after": "net_30"}
      ]
    }
  ]
}
